{"schema":"jero-ai.review-final-verification-incident/v1","class":"procedural_tooling_failure","lineage_id":"review-final-verification-example","terminal_revision":"sha256:1111111111111111111111111111111111111111111111111111111111111111","validating_revision":"sha256:2222222222222222222222222222222222222222222222222222222222222222","target_identity":"sha256:3333333333333333333333333333333333333333333333333333333333333333","failed_evidence_hash":"sha256:4444444444444444444444444444444444444444444444444444444444444444","finalize_request_digest":"sha256:5555555555555555555555555555555555555555555555555555555555555555"}
